Третировать ,"Обращаться с кем-либо пренебрежительно, свысока; не считаться с кем-либо."
Бексултан,"это слово с дневне-тюркского языка означает сильный, могучий и добрый правитель, у которого большая, хорошая репутация и вес в обществе. Также употребляется как имя мальчику в Кыргызстане и Казахстане "
Тризна,"часть языческого погребального обряда у восточных славян, состояла из песен, плясок, пиршества и военных состязаний в честь покойного"
Гиюр,"обращение нееврея в иудаизм, а также связанный с этим обряд"
Ренегат,"человек, изменивший своим убеждениям, перешедший в лагерь противников; изменник, отступник"
Топиари,искусство декоративной стрижки деревьев и кустарников
Аффектация,"неестественная, обычно показная возбужденность в поведении, в речи"
Денота́ция,лексическое значение слова
Консеквенция,"результат, последствие, итог"
Толерантность,"терпимость к иному мировоззрению, образу жизни, поведению и обычаям"
Карфология,"предагональный симптом в виде непроизвольных движений рук, напоминающих собирание чего-то с поверхности постели, своего тела или хватание чего-то будто бы пролетающего перед глазами."
Саспенс,"художественный эффект, особое продолжительное тревожное состояние зрителя при просмотре кинофильма"
Энотека,"коллекция вин, хранилище для вин, разлитых в бутылки."
Консистентность,"согласованность данных друг с другом, целостность, а также внутренняя непротиворечивость."
Пассионарный,наделенный внутренней энергией. 
Трипофобия,Боязнь повторяющихся отверстий.
Водеви́ль,"жанр легкой комедийной пьесы или спектакля с занимательной интригой или анекдотическим сюжетом, сопровождающийся музыкой"
Нарратив,"рассказ, описывающий некие фактические события, изложенные в авторском стиле интерпретатора
"
Ономатет,Создатель или творец наименований.
Деградация,"ухудшаться, вырождаться, двигаться назад в развитии"
Регургитация,"Обратное, неестественное движение газов или жидкостей."
Котильон,бальный танец французского происхождения.
Фантасмагория,"Нечто фантастическое, нереальное и причудливое, похожее на бред"
Адде́ндум,"письменное дополнение к ранее заключенному договору, в котором содержатся согласованные между сторонами изменения "
Депеша,срочное официальное уведомление
Бинди,"цветная точка, которую индианки рисуют в центре лба; она означает, что эта женщина замужем"
Хоспис,"медицинское учреждение, в котором неизличимо больные люди получают необходимую помощь и уход"
Орфоэпия,"область языкознания, отвечающая за нормы правильного литературного произношения языка, его единообразия"
Абсанс,"Кратковременное затемнение, блокировка сознания"
Парите́т,"равенство сторон, проявляющееся в равноценности и равнозначности при решении каких-либо вопросов"
Геронтофилия,влечение к людям старческого возраста
Фетиш,предмет слепого неосознанного поклонения
Дистимия,"подавленное, тоскливое настроение"
Патте́рн,набор стереотипных поведенческих реакций или последовательностей действий.
Девиа́ция,отклонение параметров от нормы
Мидриаз,Расширение зрачка
Энци́клика,"Основной папский документ по тем или иным важнейшим социально-политическим, религиозным и нравственным вопросам"
Аннотация,краткое содержание представленного труда
Перманентный,"постоянный, не меняющийся и всегда остающийся в том состоянии, в котором находится на данный момент."
Парестезия,"Чувство покалывания, онемения и мурашек в конечностях."
Ипохо́ндрик,"человек, который постоянно беспокоится о своем здоровье, боится возможности заболеть одной или несколькими болезнями"
Сентенция,изречение нравоучительного характера.
Симуля́кр,"изображение или объяснение того, что в реальности не существует"
Мюзле́,Проволочная уздечка для закрепления пробки шампанского
Инаугурация ,Церемония вступления в должность
Превенция,"предупреждение, предохранение, предотвращение."
Бирюльки,"набор мелких деревянных предметов (топорики, ухватики, лопатки, кочерги) для детской игры, состоящей в том, чтобы доставать эти предметы из кучки один за другим, не шевельнув остальных."
Лю́мпен,Лицо не имеющее никакой собственности и живущее случайными заработками
Нарцисси́зм,"черта характера, заключающаяся в исключительной самовлюблённости. Слова «нарциссизм», «нарциссический» и «нарцисс» обычно используются как негативно окрашенные, указывающие на тщеславие, самомнение, эгоизм или просто самовлюблённость"
Тет-а-тет,с глазу на глаз
Анахронизм,"ошибочное отнесение событий, явлений, предметов, личностей к другому времени"
Кавалькада,"группа всадников, едущих вместе."
Биеннале,"(лат. bis — дважды + annuus — год) выставка, фестиваль или творческий конкурс, проходящие раз в два года."
Доппельгангер,"Двойник человека, появляющийся как тёмная сторона личности или антитеза ангелу-хранителю."
Хедж-фонд,"частный, не ограниченный нормативным регулированием, инвестиционный фонд, недоступный широкому кругу лиц."
Индульгенция,"Грамота об отпущении грехов, выдаваемая католической церковью за деньги или за какие-нибудь заслуги."
Синклит,"в переносном смысле (обычно иронически) - полное собрание, заседание избранных или высокопоставленных лиц, например общее собрание акционеров. "
Пердимонокль,"Предмет или явление, вызывающее сильное удивление."
Трибьют-альбом,"Зачастую такой альбом представляет собой сборник произведений одного автора, исполнителя или музыкальной группы, записанных разными музыкантами и, таким образом, посвящённый этому исполнителю."
Библиотаф,Владелец библиотеки не позволяющий никому пользоваться своими книгами
Перистальтика,"Волнообразное сокращение стенок полых трубчатых органов (пищевода, желудка, кишечника, мочеточников и др.), способствующее продвижению их содержимого к выходным отверстиям."
Виадук,"Искусственное дорожное сооружение, служащее для пропуска транспортных средств или пешеходов над понижением рельефа"
Контроверза,"Разногласие, расхождение во мнении, спор"
Феерия,"жанр театральных представлений, основанных на применении различных постановочных эффектов, трюков, «превращений»"
Рипофобия,"навязчивый страх – боязнь грязи, нечистоты"
Регресс,"упадок в развитии чего-либо, движение назад"
Апокриф,"литературное произведение, созданное на основе другого"
Дилижанс,"Многоместный крытый экипаж, запрягавшийся лошадьми, для перевозки пассажиров и почты по определенному маршруту"
Парвеню́,"добившийся успеха, разбогатевший; выскочка"
Эпикурейство ,"Главный интерес для эпикурейцев представляет чувственный мир, поэтому их основной этический принцип — удовольствие."
Акцентуация,"ярко выраженное своеоб­разие характера, не доходящее до степе­ни патологии"
Гелертер,"ученый, обладающий широкими, но не глубокими и чисто книжными знаниями."
Мимикри́я,"подражание, маскирование"
Экспроприация,"принудительное безвозмездное или оплачиваемое отчуждение имущества, производимое государственными органами"
Клоакинг,"способ черного, то есть не совсем честного, продвижения сайтов в интернете"
Фатализм,"представление о неизбежности всего происходящего в природе и в жизни человека, исключающее случайность и свободу"
Скевоморфизм,"Физический аргумент или элемент дизайна,который скопирован с формы объекта ,но изготовлен из другого материала и иными методами"
Телегония,учение о влиянии генотипа первого самца женской особи на наследственные признаки ее потомства от последующих партнеров
Конгениальность,"сходство по духу, аналогичность хода мыслей"
Ангажированность,"предвзятое, пристрастное отношение к чему-либо; наличие сознательно выбранной позиции по какому-либо вопросу"
Берейтор,"Профессиональный всадник, осуществляющий заездку молодняка и спортивную подготовку лошадей"
Ратификация,Процесс придания документу юридической силы путем подписания сторонами соглашения.
Синергия ," комбинированное действие каких-либо компонентов, при котором суммарный эффект превышает действие каждого компонента в отдельности. "
Кагат,"Куча картофеля, корнеплодов, сложенная на земле и укрытая для длительного хранения"
Сноллигостер,"Человек руководствующийся личной выгодой, а не должностными обязанностями и
общечеловеческими принципами"
Ригидность,"Негибкость, неподатливость, оцепенелость, обусловленная напряжением мышц. Состояние, при котором снижена приспособляемость, переключаемость психических процессов к меняющимся требованиям среды.
"
Дисфория,"Пониженное настроение с раздражительностью, озлобленностью, мрачностью, повышенной чувствительностью к действиям окружающих, со склонностью к вспышкам агрессии."
Притязание,"требование, предъявление своих прав на что-нибудь; притязание на наследство"
Дефиниция,краткое определение какого-либо понятия
Калокагатия,гармония внешних и внутренних качеств человека
Хронофагия,"пожирание, убийство времени посредством интернета, тв и тд"
Плюрализм,одновременное существование нескольких независимых точек зрения по какому-либо вопросу
Триумвира́т,"Альянс между тремя лицами с целью раздела политической власти. В переносном смысле — группа из трёх человек или организаций, объединившихся для совместной деятельности."
Паллиатив,"действие или средство, не устраняющее проблему, но позволяющее отложить ее решение"
Дородный,"имеющий крупное, плотное телосложение; полный (о человеке)"
Симпозиум,"совещание, конференция (обычно с участием представителей разных стран) по какому-либо специальному (научному) вопросу"
Оскуляция,научное название поцелуя
Ламбдацизм,"врожденный дефект речи, нечеткое произношение буквы «Л»"
Бонвиван,"тот, кто любит жить в свое удовольствие, богато и беспечно"
Патернализм,"покровительство крупных государств более мелким государствам или колониям; в более широком смысле - покровительство, опека старшего младшему, подопечному"
Акселерация,"ускоренное, по сравнению с предыдущими поколениями - физическое и физиологическое развитие детей и подростков"
Бенефициант,"Некто, скорее всего участвующий и в честь - на пользу которого проводят мероприятие под названием бенефис. (см. бенефис)"
Инаугурация,церемония вступления в должность.
Пасквиль,"Сочинение, содержащее карикатурные искажения, клевету и злобные нападки, цель которых оскорбить и скомпрометировать какое-либо лицо, группу, партию, общественное движение и т.п."
Эква'йринг,"приём к оплате платёжных карт в качестве средства оплаты товара, работ, услуг."
Гедония,"Тоска по наслаждениям, стремление к удовольствиям и избежанию неприятных ощущений."
Каучсерфинг,"сеть, члены которой бесплатно предоставляют друг другу помощь и ночлег во время путешествий"
Экскурс,отступление от главной темы изложения для освещения побочного или дополнительного вопроса
Интрузия,внедрение магмы в толщину земной коры
Парафраз,"пересказ своими словами, краткое упрощенное изложение."
Филистерство,примитивное обывательское поведение и мещанское самодовольство; филистер – узколобый обыватель
Мизофобия,"боязнь грязи, навязчивый страх загрязнения"
Сие́ста,"послеобеденный отдых, являющийся общей традицией некоторых стран, особенно с жарким климатом."
Деменция,приобретенное слабоумие
Пинакотека,"хранилище живописных произведений, картинная галерея."
Эквилибристика,"Способность артиста удерживать равновесие при неустойчивом положении тела (на проволоке, на канате, на руках, на голове, на катушках, на бутылках, на стуле, на шаре и др.)."
Алкагест,"Или Универсальный растворитель (лат. Menstruum universale) в алхимии — жидкая субстанция, обладающая способностью растворять все без исключения тела (вещества)"
Ксенофо́бия,"страх или ненависть к кому-либо или чему-либо чужому, незнакомому, непривычному; восприятие чужого как непонятного, непостижимого, и поэтому опасного и враждебного. Воздвигнутая в ранг мировоззрения, может стать причиной вражды по принципу национального, религиозного или социального деления людей"
Панславизм," идеология, распространённая в государствах, населённых славянскими народами, в основе которой лежат идеи о необходимости славянского национального политического объединения на основе этнической, культурной и языковой общности. "
Дефлорация,Разрыв девственной плевы.
Интенция,"намерение, замысел; направленность сознания, воли, чувства на какой-либо предмет."
Зоопсии,"зрительные галлюцинации, содержанием которых являются животные"
Ко́мель,"Толстая часть ствола дерева непосредственно над корнем и корневищем, толстый «нижний» конец бревна или растения, корень волоса, рукоятка метлы, обвязанная часть пучка прутьев или веток, веника."
Оксю́морон,сочетание слов с противоположным значением (то есть сочетание несочетаемого)
Ляссе́,"(нем. Lesezeichen — закладка) — узкая лента в книге для закладок страниц, изготовляемая при издании книги."
Реминисценция,"отголосок, след какого-то творческого произведения в новом произведении, невольное или иногда сознательное заимствование"
Чекист,— сотрудник Всероссийской чрезвычайной комиссии по борьбе с контрреволюцией и саботажем (ЧК) и её подразделений на местах.
Акселерация ,"ускоренное (по сравнению с предыдущими поколениями, с нормой) физическое и физиологическое развитие детей и подростков."
Девиация,отклонение в показаниях компаса либо в человеческом психологическом существовании (извращение) или ненормальство на клеточном уровне.
Психоделия,"явления, связаные с «изменением» и «расширением» сознания и исследованиями устойчивости психики"
Абули́я," патологическое безволие и бесхарактерность, отсутствие желаний и побуждений к деятельности, неспособность выполнить действие, необходимость которого осознаётся; неспособность принять волевое решение."
Ингибирование,"     процесс торможения (подавления) жизненных процессов организма внешними факторами (физического, химического или психического характера).

"
Энантиодромия,"это философско-психологический закон, означающий, что всё существующее рано или поздно неизбежно переходит в свою противоположность"
Когнитивность,способность сознания к восприятию информации и ее усвоению
Протекционизм,"политика защиты внутреннего рынка от иностранной конкуренции через систему определённых ограничений: импортных и экспортных пошлин, субсидий и других мер"
Буколический,"1. безмятежный, мирный; 2.пасторальный, сельский, загородный"
Карт-бланш,полная свобода действий
Доктрина,"руководящий теоретический или политический принцип, учение, научная или философская теория."
