Чокер,"Плотно обхватывающее шею короткое ожерелье. Назван он так из-за того, что плотно прилегает к шее."
Сардонический,"Злобно-насмешливый, язвительный"
Мизантропия,"неприятие, ненависть к человечеству, неприязнь, презрение к «правилам», «моральным ценностям», догматам."
Пустула,"Пузырёк на коже, наполненный гноем."
Релятивизм,проистекает из одностороннего подчёркивания постоянной изменчивости действительности и отрицания относительной устойчивости вещей и явлений
Бихевиори́зм,"направление в психологии человека и животных, буквально — наука о поведении."
Инкубус,"мифологический злой дух в мужском обличии, приходящий женщинам в эротических снах; появление чревато неприятностями"
Биди,"Вид курительного табачного изделия, состоящего из смеси измельченных табачных листьев, табачных жилок и стеблей, завернутой в высушенный лист тенду и обвязанной нитью"
Вагитус,Крик новорожденного ребенка.
Карьеризм,"успешное продвижение в области служебной, социальной, научной и другой деятельности; продвижение вверх по служебной лестнице"
Акцессорный,"дополнительный договор, существующий лишь в связи с другим, главным договором"
Субдепрессия,"снижение настроения, не доходящее до уровня депрессии"
Эста́мп ,"произведение графического искусства, представляющее собой гравюрный либо иной оттиск на бумаге с печатной формы."
Люстра́ция,"вид политической цензуры, практика, состоящая в законодательном ограничении прав некоторых категорий лиц (выделяемых по профессиональным, партийным, религиозным или иным признакам)"
Прецессия,"колебательное движение, которое возникает в результате вращения земли вокруг своей оси"
Абстиненция,"полное воздержание от употребления спиртного, табака, наркотиков и тп"
Реинкарнация,"Переселение человеческой сущности, она же душа, из одного материального тела в другое. Научно не доказано."
Агноним,малоизвестное непонятное слово или оборот речи
Раздрай,"шумный и скандальный разброд в мнениях, поведении"
Верлибр,свободная нерифмованная стихотворная форма
Нивелировать,"уравнивать, усреднять
"
Светоч,"То, что является источником истины, правды, свободы, просвещения."
Эскалация,"постепенное усиление, распространение конфликта, обострение положения."
Аннексия,насильственное присоединение территории другого государства
Криптомнезия,"неспособность человека вспомнить, когда было то или иное событие, во сне или наяву"
Филантроп,"человек, занимающийся благотворительностью в помощь нуждающимся"
Дислекси́я,избирательное нарушение способности к овладению навыком чтения при сохранении общей способности к обучению
Ментор,"Устарелое значение наставника, воспитателя"
Пиетет,"глубокое уважение, почтительное отношение к кому-либо, чему-либо"
Инвестиция,"Долгосрочное вложение капитала в промышленность, сельское хозяйство, транспорт и другие отрасли хозяйства с целью получения прибыли."
Допельга́нгер,"Демонический двойник человека, антитеза ангелу-хранителю. В фэнтези — оборотень, способный с высокой точностью воспроизводить облик и поведение кого-либо."
Резонер,"человек, любящий вести пространные рассуждения, преимущественно нравоучительного характера"
Лапидарный,"предельно краткий, сжатый."
Ипохондрия,"мнительность, доминирующие мысли о наличии неизлечимого или очень тяжелого заболевания."
Харизма,"особая притягательность человека, авторитетность, обусловленная скорее метафизическими свойствами, чем интеллектуальными или нравственными качествами носителя харизмы"
Плеоназм,"оборот речи, не добавляющий никакого смысла в предложении"
Соционика,"Это наука, изучающая процесс обмена информацией между человеком и внешним миром, т.е. каким образом люди воспринимают, перерабатывают и выдают информацию."
Плеяда,группа выдающихся деятелей на каком-либо поприще в одну эпоху
Тезаурус,"Специальные словари, в которых все значения словаря связаны между собой семантическими отношениями."
Апгрейд,"то же, что модернизация, обновление (программного обеспечения, аппаратуры) "
Бестия," плут, пройдоха; ловкий, хитрый человек."
Ресентиме́нт,"Чувство враждебности к тому, что субъект считает причиной своих неудач, бессильная зависть, «тягостное сознание тщетности попыток повысить свой статус в жизни или в обществе»."
Ши́льдик,"информационная табличка, на которой размещены надписи и обозначения, относящиеся к маркируемому изделию. Применяются для этикетирования товаров фирменного изготовления — компьютеров, бытовой и видео/аудиотехники, эксклюзивной косметики, автомобилей."
Экстру́зия,"тип извержения, свойственный вулканам с вязкой лавой"
Ажитация,"сильное эмоциональное возбуждение, сопровождаемое чувством тревоги и страха "
Интерференция,В психологии- взаимоподавление одновременно осуществляющихся психических процессов; обусловлена ограниченным объёмом распределяемого внимания.
Людус,"В Древней Греции так обозначалось чувство, под которым понималась гедонистическая любовь-игра, не отличающаяся глубиной чувства и сравнительно легко допускающаяся возможность измены."
Этатизм,"идеология, утверждающая ведущую роль государства в политической жизни, включая подчинение интересов как отдельных людей, так и групп интересам государства; политика активного вмешательства государства во все сферы общественной и частной жизни."
Бронтофобия,"боязнь грома, молнии, грозы в целом"
Ирритация,"сильное волнение, возбуждение, раздражение."
Такыр,"ровные участки местности в пустынях и полупустынях, почти лишенные растительности, заливаемые водой в весеннее время. 
Поверхностный слой грунта в пределах такыров представлены глинистыми отложениями, преимущественно илом. В летнее время они высыхает, затвердевает и покрывается полигональными трещинами"
Сукцессия,Процесс саморазвития биогеоценоза.
Жеманный,"лишенный непринужденности, естественности, простоты; манерный"
Закомара,"Полукруглое или килевидное завершение верхней части одного прясла стены храма, обычно соответствующее форме внутреннего свода"
Маскот,"первоначально название человека, животного или объекта, приносящего удачу 
— сейчас это практически любой персонаж, человекоподобный и не очень, представляющий некий коллектив."
Перкуссиони́ст,"музыкант, играющий на ударных музыкальных инструментах.

В профессиональном лексиконе перкуссионистами чаще всего называют ударников, играющих на различных мелких ударных инструментах: ручных, этнических (народных) или оркестровых."
Анаэробы,"организмы, способные жить и развиваться в отсутствие свободного кислорода."
Экслибрис,"Эксли́брис (от лат. ex libris — «из книг») — книжный знак, наклеиваемый владельцами библиотек на книгу, преимущественно на внутреннюю сторону переплета. "
Витальность,"жизненность, проявление жизни"
Анагога,"прием раскрытия и доказательства существования недоступного для непосвященных смысла слова, текста или его части"
Танатофобия,навязчивый страх смерти
Пе́плум,"Жанр исторического кино, для которого характерно использование античных или библейских сюжетов, больша́я продолжительность фильма, масштабность."
Апофени́я,"переживание, заключающееся в способности видеть структуру или взаимосвязи в случайных или бессмысленных данных."
Акафист,"Жанр православной церковной гимнографии, представляющий собой благодарственное пение, посвященную тому или иному святому."
Паттерн,"Закономернуая регулярность, встречающаяся в природе и в человеческом дизайне, а также повторяющийся шаблон, образец"
Куафер,"Куафер-он же цирюльник,он же брадобрей...
Слово ""куафер"" пришло к нам из далекого,древнего,и могучего русского языка,и именно так в старину называли парикмахеров..."
Истеблишмент,"власть имущие, правящие круги, политическая элита; совокупность людей, занимающих ключевые позиции в социально-политической системе"
Гаптофобия ,боязнь прикосновений других людей
Атавизм,"появление у человека, животных или растений признаков, свойственных их отдалённым предкам."
Палимпсест,"древняя рукопись, обычно пергаментная, с которой стерт первоначальный текст и на его месте написан новый"
Сфи́нктер,клапанное устройство для перехода вещества из одного органа в другой
Маскулинность,"Комплекс телесных, психических и поведенческих особенностей"
Афазия,системное нарушение уже сформировавшейся речи
Абстрагировался,Отвлечься мысленно от чего-либо.
Сексо́мния,"расстройство психики, при котором человек во время сна занимается сексом или проявляет другую сексуальную активность"
Гомогенный,"однородный, измельченный до такого состояния, что частички не отличаются друг от друга размерами"
Базофобия,"навязчивый страх, боязнь ходьбы"
Лупанарий,публичный дом
Фо́ртель,"Ловкая проделка, неожиданная выходка"
Афтершо́к,"Повторный сейсмический толчок, менее интенсивный, чем главный сейсмический удар."
Трансмиссия,Система устройств для передачи на расстояние механической энергии и для распределения ее по местам потребления.
Фрамуга,"горизонтальная верхняя створка окна, боковая или верхняя створка двери"
Апперцепция,Зависимость восприятия от личного прошлого опыта и индивидуальных особенностей.
Трискаидекафобия,"боязнь числа «13», основанная на предрассудках"
Мизансцена,расположение актёров в тот/иной момент спектакля.
Физиология,Наука о жизнедеятельности целостного организма и отдельных его частей 
Пауперизация,"массовое обнищание, нищета"
Азотемия,"присутствие в организме излишнего количества азота, при нормальном состоянии выводимого наружу с мочой. Наступает при некоторых заболеваниях почек."
Пранк,"Телефонное хулиганство, телефонный розыгрыш."
Анальгетики,"Препараты, которые уменьшают боль."
Фанабе́рия,"Спесь, необоснованная гордыня, напыщенность, звездная болезнь. В русский язык слово пришло из польского, а туда — из идиша."
Эпиго́нство,"Подражательная, лишенная творческой оригинальности деятельность в какой-нибудь интеллектуальной сфере "
Начётничество,"знания, основанные на некритическом усвоении прочитанного"
Жантильность,"Нежность, умиление в произношении, чтоб подчеркнуть мягкость"
Схоластика,"оторванное от жизни умствование; изначально учение, сочетавшее в себе религиозно-догматические идеи и рациональные методы познания"
Редукция,"переход от сложного к простому, ослабление чего-либо"
Дактилология,форма речи использующая пальцы руки
Депозит,"Какие-либо ценности, активы, размещенные в специализированной организации."
Аккола́да,Одна из частей средневекового обряда посвящения в рыцари или принятия в рыцарский орден.
Лакшми,"богиня изобилия, процветания, богатства, удачи и счастья"
Депонирование,процесс организованного хранения чего-либо
Никтофобия,страх перед ночью и бессонницей
Зиккурат ,многоступенчатое культовое сооружение.
Навмахия,"гладиаторское морское сражение в
Древнем Риме"
Флоэмы,Длинные волокна на кожуре от банана.
Адгезия,связь между разнородными телами при их контакте.
Фальсифика́ция,"Подделка, выдаваемая за настоящую вещь, изменение(обычно с корыстной целью) вида или свойства предметов."
Антагони́ст,"Нечто, действующее противоположным образом, также соперник."
Мондиализм,проект по установлению мирового правительства.
Лю́верс,"также его разновидность блочка — металлическая или пластиковая втулка, устанавливаемая в кожгалантерейные, обувные швейные и другие изделия, бумагу для укрепления краёв отверстий, использующихся для продевания верёвок, шнуров, тесьмы, тросов и т. д.; по сути, является разновидностью заклёпки с отверстием."
Трепанация,хирургическая операция образования отверстия в костной ткани черепа с целью доступа к подлежащей полости
Хиатус,перерыв в показе регулярной телевизионной программы
Чета,"Пара, два предмета, муж и жена, возлюбленные. "
Каузальный,"причинный, связанный с взаимообусловленностью событий во времени"
Сантименты,"чувства; проявление излишней чувствительности в словах, поступках"
Какафония,"негармоническое, режущее слух сочетание звуков; неблагозвучие (в музыке, стихах)"
Семантика,в языкознании исследование смыслового наполнения единиц языка
Аподиктический,"безусловно достоверный, основанный на необходимости, неопровержимый."
Штрейкбрехерство,"предательство интересов. Штрейкбрехер – человек, согласившийся работать в период забастовки, тем самым, срывая ее."
Консенсус,"договоренность, согласие по поводу условий осуществления операции, деятельности, в которых заинтересованы несколько сторон"
Идея фикс,"некая идея, полностью поглотившая человека"
Аденоиды,Опухолевидные разрастания носоглоточных миндалин
Ангст,"постоянное состояние смертного, в прямом смысле слова, страха и тоски"
Коннотация,"дополнительное значение чего-либо, вторичное, сопутствующее"
Нейтралитет,"Отношение к сложившейся ситуации, выраженное в отсутствии  приоритетов в таковой"
Апория,"это вымышленная, логически верная, ситуация или суждение, которое тем не менее не может существовать в реальности"
Инвентаризация,проверка наличия имущества организации и состояния её финансовых обязательств на определённую дату путём сличения фактических данных с данными бухгалтерского учёта
 гештальт,"форма или образ, как некие целостные образования и первооснова психики."
Персистенция,Способность глаза соединять быстро сменяющиеся изображения в одно
Верминофобия,"одна из фобий в психиатрии, боязнь заражения какой-нибудь болезнью микроорганизмов, бактерий, микробов и вирусов, червей, насекомых"
Грумминг,уход за домашними животными
Апломб,Высокомерная самоуверенность в поведенческом стиле.
Парапетазма,Занавес (обычно театральный).
Кроссинговер,"Явление перекрёста хромосом, при котором гомологичные хромосомы наследуются преимущественно вместе. "
Аперитив,"напиток, подаваемый перед едой и вызывающий аппетит, слюноотделение и улучшающий пищеварение."
Омнибус,"Многоместная (15—20 мест) повозка на конной тяге. Вид городского общественного транспорта, характерный для второй половины XIX века."
Мимесис,"категория эстетики, которая объясняет искусство как подражание природе"
Мемомагнетика,коллекционирование магнитиков на холодильник
Биом,Совокупность экосистем одной природно-климатической зоны
Офиофобия,Боязнь змей
Апотропей,"в археологии и этнографии название предметов и изображений, которым приписывалась магическая способность отгонять злых д"
Аскеза,"Духовная практика,в основе которой лежит самоограничение,воздержание,и закалка какой либо черты характера."
